id,building_id,employee_id,building_type,status,date_of_installation,date_of_inspection,inspection_certificate,information,notes,created_at,updated_at
53,53,53,Residential,Inactive,6/20/2016,6/25/1989,Not Certified,"Etiam vel augue. Vestibulum rutrum rutrum neque. Aenean auctor gravida sem. Praesent id massa id nisl venenatis lacinia. Aenean sit amet justo. Morbi ut odio. Cras mi pede, malesuada in, imperdiet et, commodo vulputate, justo. In blandit ultrices enim. Lorem ipsum dolor sit amet, consectetuer adipiscing elit. Proin interdum mauris non ligula pellentesque ultrices.",in purus eu magna vulputate luctus cum sociis natoque penatibus et magnis dis parturient montes,4/6/2013,5/5/2004
54,54,54,Hybrid,Inactive,7/2/1981,7/13/2004,Certified,"Nunc nisl. Duis bibendum, felis sed interdum venenatis, turpis enim blandit mi, in porttitor pede justo eu massa. Donec dapibus. Duis at velit eu est congue elementum. In hac habitasse platea dictumst. Morbi vestibulum, velit id pretium iaculis, diam erat fermentum justo, nec condimentum neque sapien placerat ante. Nulla justo.",non velit donec diam neque vestibulum eget vulputate ut ultrices vel augue vestibulum,5/4/1990,10/24/2011
55,55,55,Hybrid,Active,3/19/2004,8/12/2009,Certified,"Praesent lectus. Vestibulum quam sapien, varius ut, blandit non, interdum in, ante. Vestibulum ante ipsum primis in faucibus orci luctus et ultrices posuere cubilia Curae; Duis faucibus accumsan odio. Curabitur convallis. Duis consequat dui nec nisi volutpat eleifend. Donec ut dolor. Morbi vel lectus in quam fringilla rhoncus.",libero nullam sit amet turpis elementum ligula vehicula consequat morbi a ipsum integer a nibh in,11/9/1997,1/7/1984
56,56,56,Corporate,Active,8/27/1996,1/19/1996,Not Certified,Suspendisse accumsan tortor quis turpis. Sed ante. Vivamus tortor. Duis mattis egestas metus. Aenean fermentum.,cras in purus eu magna vulputate luctus cum sociis natoque penatibus et magnis dis parturient montes nascetur,4/22/2002,5/22/1982
57,57,57,Commercial,Inactive,8/30/1981,9/19/2017,Certified,"Ut tellus. Nulla ut erat id mauris vulputate elementum. Nullam varius. Nulla facilisi. Cras non velit nec nisi vulputate nonummy. Maecenas tincidunt lacus at velit. Vivamus vel nulla eget eros elementum pellentesque. Quisque porta volutpat erat. Quisque erat eros, viverra eget, congue eget, semper rutrum, nulla. Nunc purus.",venenatis turpis enim blandit mi in porttitor pede justo eu massa donec dapibus duis at velit,6/7/2018,4/20/2004
58,58,58,Hybrid,Inactive,7/30/2010,9/18/1991,Certified,"Vestibulum ac est lacinia nisi venenatis tristique. Fusce congue, diam id ornare imperdiet, sapien urna pretium nisl, ut volutpat sapien arcu sed augue. Aliquam erat volutpat. In congue. Etiam justo.",sed augue aliquam erat volutpat in congue etiam justo etiam pretium iaculis justo in hac habitasse platea dictumst etiam,12/7/2012,10/14/2012
59,59,59,Corporate,Active,2/17/1980,1/31/1976,Certified,Vestibulum rutrum rutrum neque. Aenean auctor gravida sem. Praesent id massa id nisl venenatis lacinia. Aenean sit amet justo. Morbi ut odio.,nam ultrices libero non mattis pulvinar nulla pede ullamcorper augue a suscipit nulla elit ac,10/26/1990,3/27/2018
60,60,60,Residential,Inactive,4/26/2013,3/16/1979,Certified,"Donec posuere metus vitae ipsum. Aliquam non mauris. Morbi non lectus. Aliquam sit amet diam in magna bibendum imperdiet. Nullam orci pede, venenatis non, sodales sed, tincidunt eu, felis. Fusce posuere felis sed lacus. Morbi sem mauris, laoreet ut, rhoncus aliquet, pulvinar sed, nisl. Nunc rhoncus dui vel sem.",pede posuere nonummy integer non velit donec diam neque vestibulum eget vulputate ut ultrices,2/16/1979,12/15/2004
61,61,61,Residential,Active,7/12/1976,6/8/2003,Not Certified,"Aenean auctor gravida sem. Praesent id massa id nisl venenatis lacinia. Aenean sit amet justo. Morbi ut odio. Cras mi pede, malesuada in, imperdiet et, commodo vulputate, justo. In blandit ultrices enim. Lorem ipsum dolor sit amet, consectetuer adipiscing elit. Proin interdum mauris non ligula pellentesque ultrices. Phasellus id sapien in sapien iaculis congue.",at vulputate vitae nisl aenean lectus pellentesque eget nunc donec quis orci eget orci vehicula condimentum curabitur in,6/1/2001,6/11/1998
62,62,62,Commercial,Active,5/3/1978,3/9/2007,Certified,"Donec ut dolor. Morbi vel lectus in quam fringilla rhoncus. Mauris enim leo, rhoncus sed, vestibulum sit amet, cursus id, turpis. Integer aliquet, massa id lobortis convallis, tortor risus dapibus augue, vel accumsan tellus nisi eu orci. Mauris lacinia sapien quis libero. Nullam sit amet turpis elementum ligula vehicula consequat.",nonummy integer non velit donec diam neque vestibulum eget vulputate ut ultrices vel augue vestibulum ante,9/10/1987,12/20/2002
63,63,63,Residential,Inactive,12/27/2006,10/15/2000,Certified,"Nullam varius. Nulla facilisi. Cras non velit nec nisi vulputate nonummy. Maecenas tincidunt lacus at velit. Vivamus vel nulla eget eros elementum pellentesque. Quisque porta volutpat erat. Quisque erat eros, viverra eget, congue eget, semper rutrum, nulla. Nunc purus. Phasellus in felis.",semper est quam pharetra magna ac consequat metus sapien ut nunc vestibulum ante,5/1/1977,10/25/2013
64,64,64,Residential,Active,2/7/1979,2/16/1978,Certified,"Nulla nisl. Nunc nisl. Duis bibendum, felis sed interdum venenatis, turpis enim blandit mi, in porttitor pede justo eu massa. Donec dapibus. Duis at velit eu est congue elementum. In hac habitasse platea dictumst.",condimentum curabitur in libero ut massa volutpat convallis morbi odio odio elementum eu interdum eu,4/22/1999,7/14/1987
65,65,65,Hybrid,Active,9/18/2018,11/27/1993,Certified,"Nulla ut erat id mauris vulputate elementum. Nullam varius. Nulla facilisi. Cras non velit nec nisi vulputate nonummy. Maecenas tincidunt lacus at velit. Vivamus vel nulla eget eros elementum pellentesque. Quisque porta volutpat erat. Quisque erat eros, viverra eget, congue eget, semper rutrum, nulla.",platea dictumst aliquam augue quam sollicitudin vitae consectetuer eget rutrum at lorem integer tincidunt ante vel ipsum,4/29/1990,6/21/2002
66,66,66,Corporate,Active,8/30/1977,3/5/2016,Certified,Suspendisse potenti. In eleifend quam a odio. In hac habitasse platea dictumst. Maecenas ut massa quis augue luctus tincidunt. Nulla mollis molestie lorem. Quisque ut erat. Curabitur gravida nisi at nibh.,mi integer ac neque duis bibendum morbi non quam nec dui luctus rutrum nulla tellus in sagittis dui vel,1/1/1981,5/16/1993
67,67,67,Commercial,Active,5/19/1981,11/23/2005,Not Certified,"Etiam faucibus cursus urna. Ut tellus. Nulla ut erat id mauris vulputate elementum. Nullam varius. Nulla facilisi. Cras non velit nec nisi vulputate nonummy. Maecenas tincidunt lacus at velit. Vivamus vel nulla eget eros elementum pellentesque. Quisque porta volutpat erat. Quisque erat eros, viverra eget, congue eget, semper rutrum, nulla.",natoque penatibus et magnis dis parturient montes nascetur ridiculus mus etiam vel,5/2/2009,2/16/1978
68,68,68,Commercial,Active,2/21/2006,1/20/2018,Not Certified,"Nulla facilisi. Cras non velit nec nisi vulputate nonummy. Maecenas tincidunt lacus at velit. Vivamus vel nulla eget eros elementum pellentesque. Quisque porta volutpat erat. Quisque erat eros, viverra eget, congue eget, semper rutrum, nulla. Nunc purus. Phasellus in felis. Donec semper sapien a libero. Nam dui.",ullamcorper purus sit amet nulla quisque arcu libero rutrum ac lobortis vel dapibus at,3/3/1984,12/15/1986
69,69,69,Corporate,Inactive,7/26/1990,2/2/2007,Certified,"Vivamus metus arcu, adipiscing molestie, hendrerit at, vulputate vitae, nisl. Aenean lectus. Pellentesque eget nunc. Donec quis orci eget orci vehicula condimentum. Curabitur in libero ut massa volutpat convallis. Morbi odio odio, elementum eu, interdum eu, tincidunt in, leo.",donec vitae nisi nam ultrices libero non mattis pulvinar nulla pede ullamcorper augue,7/8/1997,7/2/1989
70,70,70,Commercial,Inactive,11/6/1995,1/5/1980,Certified,"Nunc nisl. Duis bibendum, felis sed interdum venenatis, turpis enim blandit mi, in porttitor pede justo eu massa. Donec dapibus. Duis at velit eu est congue elementum. In hac habitasse platea dictumst. Morbi vestibulum, velit id pretium iaculis, diam erat fermentum justo, nec condimentum neque sapien placerat ante.",rutrum nulla nunc purus phasellus in felis donec semper sapien a libero nam,7/6/1977,8/13/1976
71,71,71,Commercial,Inactive,12/5/1988,9/19/1994,Not Certified,"Ut at dolor quis odio consequat varius. Integer ac leo. Pellentesque ultrices mattis odio. Donec vitae nisi. Nam ultrices, libero non mattis pulvinar, nulla pede ullamcorper augue, a suscipit nulla elit ac nulla. Sed vel enim sit amet nunc viverra dapibus. Nulla suscipit ligula in lacus. Curabitur at ipsum ac tellus semper interdum. Mauris ullamcorper purus sit amet nulla. Quisque arcu libero, rutrum ac, lobortis vel, dapibus at, diam.",suscipit a feugiat et eros vestibulum ac est lacinia nisi venenatis tristique fusce congue diam id,6/22/1992,10/27/2009
72,72,72,Hybrid,Inactive,12/13/1975,9/19/1990,Certified,"Praesent blandit. Nam nulla. Integer pede justo, lacinia eget, tincidunt eget, tempus vel, pede. Morbi porttitor lorem id ligula. Suspendisse ornare consequat lectus. In est risus, auctor sed, tristique in, tempus sit amet, sem.",id nisl venenatis lacinia aenean sit amet justo morbi ut odio cras mi pede malesuada in,9/15/1984,11/15/2012
73,73,73,Corporate,Inactive,5/25/2004,5/10/1992,Not Certified,"Morbi vel lectus in quam fringilla rhoncus. Mauris enim leo, rhoncus sed, vestibulum sit amet, cursus id, turpis. Integer aliquet, massa id lobortis convallis, tortor risus dapibus augue, vel accumsan tellus nisi eu orci. Mauris lacinia sapien quis libero. Nullam sit amet turpis elementum ligula vehicula consequat. Morbi a ipsum.",purus phasellus in felis donec semper sapien a libero nam dui proin leo,10/4/2013,3/18/2017
74,74,74,Hybrid,Active,4/15/2015,5/1/1998,Not Certified,"Phasellus id sapien in sapien iaculis congue. Vivamus metus arcu, adipiscing molestie, hendrerit at, vulputate vitae, nisl. Aenean lectus. Pellentesque eget nunc. Donec quis orci eget orci vehicula condimentum. Curabitur in libero ut massa volutpat convallis. Morbi odio odio, elementum eu, interdum eu, tincidunt in, leo. Maecenas pulvinar lobortis est. Phasellus sit amet erat.",nulla nisl nunc nisl duis bibendum felis sed interdum venenatis turpis enim blandit mi in,4/1/2001,3/3/1999
75,75,75,Hybrid,Active,12/6/1999,10/22/1996,Certified,"Proin interdum mauris non ligula pellentesque ultrices. Phasellus id sapien in sapien iaculis congue. Vivamus metus arcu, adipiscing molestie, hendrerit at, vulputate vitae, nisl. Aenean lectus. Pellentesque eget nunc. Donec quis orci eget orci vehicula condimentum.",egestas metus aenean fermentum donec ut mauris eget massa tempor convallis nulla neque libero convallis eget eleifend luctus ultricies,1/27/2001,7/23/2016
76,76,76,Corporate,Active,5/13/2019,2/15/2019,Not Certified,"Nullam varius. Nulla facilisi. Cras non velit nec nisi vulputate nonummy. Maecenas tincidunt lacus at velit. Vivamus vel nulla eget eros elementum pellentesque. Quisque porta volutpat erat. Quisque erat eros, viverra eget, congue eget, semper rutrum, nulla. Nunc purus.",rutrum neque aenean auctor gravida sem praesent id massa id nisl venenatis lacinia aenean sit amet justo,6/1/2018,8/11/2015
77,77,77,Residential,Active,12/24/1983,8/4/2001,Not Certified,"Pellentesque eget nunc. Donec quis orci eget orci vehicula condimentum. Curabitur in libero ut massa volutpat convallis. Morbi odio odio, elementum eu, interdum eu, tincidunt in, leo. Maecenas pulvinar lobortis est. Phasellus sit amet erat.",et magnis dis parturient montes nascetur ridiculus mus etiam vel augue vestibulum rutrum rutrum neque aenean auctor gravida,1/28/2016,12/26/2013
78,78,78,Residential,Active,2/9/1997,4/25/1992,Not Certified,"Donec quis orci eget orci vehicula condimentum. Curabitur in libero ut massa volutpat convallis. Morbi odio odio, elementum eu, interdum eu, tincidunt in, leo. Maecenas pulvinar lobortis est. Phasellus sit amet erat.",potenti cras in purus eu magna vulputate luctus cum sociis natoque penatibus et magnis dis parturient montes nascetur ridiculus mus,11/1/1985,4/26/1978
79,79,79,Hybrid,Inactive,10/12/1996,10/8/1991,Certified,"Maecenas tristique, est et tempus semper, est quam pharetra magna, ac consequat metus sapien ut nunc. Vestibulum ante ipsum primis in faucibus orci luctus et ultrices posuere cubilia Curae; Mauris viverra diam vitae quam. Suspendisse potenti. Nullam porttitor lacus at turpis. Donec posuere metus vitae ipsum.",luctus ultricies eu nibh quisque id justo sit amet sapien dignissim vestibulum vestibulum ante ipsum primis in faucibus,11/6/2010,10/19/2013
80,80,80,Corporate,Active,10/10/1987,10/1/1999,Certified,Aliquam erat volutpat. In congue. Etiam justo. Etiam pretium iaculis justo. In hac habitasse platea dictumst. Etiam faucibus cursus urna.,augue vel accumsan tellus nisi eu orci mauris lacinia sapien quis libero nullam sit amet turpis,5/2/1982,12/12/2004
81,81,81,Residential,Active,9/15/1998,4/12/1986,Not Certified,Etiam faucibus cursus urna. Ut tellus. Nulla ut erat id mauris vulputate elementum. Nullam varius. Nulla facilisi. Cras non velit nec nisi vulputate nonummy. Maecenas tincidunt lacus at velit. Vivamus vel nulla eget eros elementum pellentesque.,sapien cursus vestibulum proin eu mi nulla ac enim in tempor turpis nec euismod scelerisque quam,9/2/1982,3/11/1992
82,82,82,Commercial,Inactive,4/28/1987,6/11/2011,Not Certified,"Phasellus in felis. Donec semper sapien a libero. Nam dui. Proin leo odio, porttitor id, consequat in, consequat ut, nulla. Sed accumsan felis. Ut at dolor quis odio consequat varius. Integer ac leo. Pellentesque ultrices mattis odio.",aliquam lacus morbi quis tortor id nulla ultrices aliquet maecenas leo odio condimentum id luctus nec molestie sed,9/6/1980,12/5/1991
83,83,83,Corporate,Active,12/5/1996,8/16/2016,Not Certified,"Suspendisse ornare consequat lectus. In est risus, auctor sed, tristique in, tempus sit amet, sem. Fusce consequat. Nulla nisl. Nunc nisl. Duis bibendum, felis sed interdum venenatis, turpis enim blandit mi, in porttitor pede justo eu massa. Donec dapibus. Duis at velit eu est congue elementum.",turpis nec euismod scelerisque quam turpis adipiscing lorem vitae mattis nibh ligula nec sem duis,7/7/1990,5/11/2012
84,84,84,Hybrid,Active,2/8/2013,9/24/2017,Certified,"Maecenas rhoncus aliquam lacus. Morbi quis tortor id nulla ultrices aliquet. Maecenas leo odio, condimentum id, luctus nec, molestie sed, justo. Pellentesque viverra pede ac diam. Cras pellentesque volutpat dui. Maecenas tristique, est et tempus semper, est quam pharetra magna, ac consequat metus sapien ut nunc. Vestibulum ante ipsum primis in faucibus orci luctus et ultrices posuere cubilia Curae; Mauris viverra diam vitae quam. Suspendisse potenti. Nullam porttitor lacus at turpis.",tellus semper interdum mauris ullamcorper purus sit amet nulla quisque arcu libero rutrum ac lobortis vel dapibus at diam nam,4/20/1987,10/6/1977
85,85,85,Residential,Active,5/29/1986,4/29/2004,Not Certified,"Vestibulum ante ipsum primis in faucibus orci luctus et ultrices posuere cubilia Curae; Duis faucibus accumsan odio. Curabitur convallis. Duis consequat dui nec nisi volutpat eleifend. Donec ut dolor. Morbi vel lectus in quam fringilla rhoncus. Mauris enim leo, rhoncus sed, vestibulum sit amet, cursus id, turpis. Integer aliquet, massa id lobortis convallis, tortor risus dapibus augue, vel accumsan tellus nisi eu orci.",ultrices phasellus id sapien in sapien iaculis congue vivamus metus arcu adipiscing molestie hendrerit at vulputate vitae nisl,10/22/2012,8/18/2004
86,86,86,Hybrid,Active,8/9/1986,12/3/1976,Not Certified,Aliquam quis turpis eget elit sodales scelerisque. Mauris sit amet eros. Suspendisse accumsan tortor quis turpis. Sed ante. Vivamus tortor.,a pede posuere nonummy integer non velit donec diam neque vestibulum eget vulputate ut ultrices vel augue vestibulum ante,7/7/1982,9/20/1990
87,87,87,Commercial,Inactive,11/16/2013,12/23/1985,Not Certified,Nullam sit amet turpis elementum ligula vehicula consequat. Morbi a ipsum. Integer a nibh. In quis justo. Maecenas rhoncus aliquam lacus. Morbi quis tortor id nulla ultrices aliquet.,mauris enim leo rhoncus sed vestibulum sit amet cursus id turpis integer aliquet massa,5/23/2000,2/9/2014
88,88,88,Hybrid,Active,1/21/1981,2/9/2006,Certified,"Nulla justo. Aliquam quis turpis eget elit sodales scelerisque. Mauris sit amet eros. Suspendisse accumsan tortor quis turpis. Sed ante. Vivamus tortor. Duis mattis egestas metus. Aenean fermentum. Donec ut mauris eget massa tempor convallis. Nulla neque libero, convallis eget, eleifend luctus, ultricies eu, nibh.",erat tortor sollicitudin mi sit amet lobortis sapien sapien non mi,3/10/1993,3/5/1989
89,89,89,Residential,Inactive,12/24/2012,7/18/1981,Not Certified,"Maecenas leo odio, condimentum id, luctus nec, molestie sed, justo. Pellentesque viverra pede ac diam. Cras pellentesque volutpat dui. Maecenas tristique, est et tempus semper, est quam pharetra magna, ac consequat metus sapien ut nunc. Vestibulum ante ipsum primis in faucibus orci luctus et ultrices posuere cubilia Curae; Mauris viverra diam vitae quam. Suspendisse potenti.",faucibus orci luctus et ultrices posuere cubilia curae nulla dapibus dolor vel est donec odio justo sollicitudin ut,3/29/1998,6/3/2010
90,90,90,Residential,Inactive,5/31/1980,4/9/2014,Certified,"Aenean auctor gravida sem. Praesent id massa id nisl venenatis lacinia. Aenean sit amet justo. Morbi ut odio. Cras mi pede, malesuada in, imperdiet et, commodo vulputate, justo. In blandit ultrices enim. Lorem ipsum dolor sit amet, consectetuer adipiscing elit. Proin interdum mauris non ligula pellentesque ultrices. Phasellus id sapien in sapien iaculis congue.",turpis elementum ligula vehicula consequat morbi a ipsum integer a nibh in quis justo maecenas rhoncus aliquam lacus morbi quis,2/2/2018,9/25/1991
91,91,91,Residential,Active,2/7/2002,3/13/2003,Not Certified,Nulla justo. Aliquam quis turpis eget elit sodales scelerisque. Mauris sit amet eros. Suspendisse accumsan tortor quis turpis. Sed ante. Vivamus tortor. Duis mattis egestas metus. Aenean fermentum. Donec ut mauris eget massa tempor convallis.,lobortis convallis tortor risus dapibus augue vel accumsan tellus nisi eu orci mauris lacinia,11/24/2013,12/17/2010
92,92,92,Corporate,Active,8/18/1981,12/20/2017,Not Certified,"Maecenas tristique, est et tempus semper, est quam pharetra magna, ac consequat metus sapien ut nunc. Vestibulum ante ipsum primis in faucibus orci luctus et ultrices posuere cubilia Curae; Mauris viverra diam vitae quam. Suspendisse potenti. Nullam porttitor lacus at turpis. Donec posuere metus vitae ipsum. Aliquam non mauris. Morbi non lectus. Aliquam sit amet diam in magna bibendum imperdiet.",mi sit amet lobortis sapien sapien non mi integer ac,3/25/2018,4/5/2010
93,93,93,Residential,Inactive,4/1/2005,4/14/2012,Not Certified,"Nam congue, risus semper porta volutpat, quam pede lobortis ligula, sit amet eleifend pede libero quis orci. Nullam molestie nibh in lectus. Pellentesque at nulla. Suspendisse potenti. Cras in purus eu magna vulputate luctus. Cum sociis natoque penatibus et magnis dis parturient montes, nascetur ridiculus mus.",diam in magna bibendum imperdiet nullam orci pede venenatis non sodales sed tincidunt eu felis fusce posuere,8/11/2019,4/26/2019
94,94,94,Hybrid,Inactive,6/16/1991,12/22/2014,Not Certified,"In est risus, auctor sed, tristique in, tempus sit amet, sem. Fusce consequat. Nulla nisl. Nunc nisl. Duis bibendum, felis sed interdum venenatis, turpis enim blandit mi, in porttitor pede justo eu massa. Donec dapibus. Duis at velit eu est congue elementum. In hac habitasse platea dictumst.",maecenas rhoncus aliquam lacus morbi quis tortor id nulla ultrices aliquet maecenas leo,10/14/2015,8/14/2012
95,95,95,Residential,Inactive,6/17/1990,1/17/2017,Certified,"Morbi vestibulum, velit id pretium iaculis, diam erat fermentum justo, nec condimentum neque sapien placerat ante. Nulla justo. Aliquam quis turpis eget elit sodales scelerisque. Mauris sit amet eros. Suspendisse accumsan tortor quis turpis. Sed ante.",posuere cubilia curae duis faucibus accumsan odio curabitur convallis duis,12/10/1997,11/23/2003
96,96,96,Hybrid,Active,7/19/2017,1/10/2006,Certified,"Curabitur in libero ut massa volutpat convallis. Morbi odio odio, elementum eu, interdum eu, tincidunt in, leo. Maecenas pulvinar lobortis est. Phasellus sit amet erat. Nulla tempus. Vivamus in felis eu sapien cursus vestibulum. Proin eu mi. Nulla ac enim. In tempor, turpis nec euismod scelerisque, quam turpis adipiscing lorem, vitae mattis nibh ligula nec sem.",quam fringilla rhoncus mauris enim leo rhoncus sed vestibulum sit amet cursus id turpis integer aliquet,3/25/1988,4/25/2018
97,97,97,Residential,Active,6/9/1979,4/2/2010,Not Certified,"Proin eu mi. Nulla ac enim. In tempor, turpis nec euismod scelerisque, quam turpis adipiscing lorem, vitae mattis nibh ligula nec sem. Duis aliquam convallis nunc. Proin at turpis a pede posuere nonummy. Integer non velit. Donec diam neque, vestibulum eget, vulputate ut, ultrices vel, augue. Vestibulum ante ipsum primis in faucibus orci luctus et ultrices posuere cubilia Curae; Donec pharetra, magna vestibulum aliquet ultrices, erat tortor sollicitudin mi, sit amet lobortis sapien sapien non mi. Integer ac neque. Duis bibendum.",dui vel nisl duis ac nibh fusce lacus purus aliquet at feugiat non pretium quis lectus suspendisse,4/30/1994,4/19/1983
98,98,98,Corporate,Inactive,9/28/2019,2/29/1976,Not Certified,"Quisque erat eros, viverra eget, congue eget, semper rutrum, nulla. Nunc purus. Phasellus in felis. Donec semper sapien a libero. Nam dui. Proin leo odio, porttitor id, consequat in, consequat ut, nulla.",erat fermentum justo nec condimentum neque sapien placerat ante nulla,7/3/1994,6/5/1976
99,99,99,Hybrid,Active,7/20/1994,11/30/1991,Not Certified,"Nullam orci pede, venenatis non, sodales sed, tincidunt eu, felis. Fusce posuere felis sed lacus. Morbi sem mauris, laoreet ut, rhoncus aliquet, pulvinar sed, nisl. Nunc rhoncus dui vel sem. Sed sagittis. Nam congue, risus semper porta volutpat, quam pede lobortis ligula, sit amet eleifend pede libero quis orci.",porttitor lacus at turpis donec posuere metus vitae ipsum aliquam non mauris morbi,9/10/2018,5/14/1988
100,100,100,Commercial,Active,7/27/1981,12/27/2004,Certified,In hac habitasse platea dictumst. Etiam faucibus cursus urna. Ut tellus. Nulla ut erat id mauris vulputate elementum. Nullam varius. Nulla facilisi.,arcu adipiscing molestie hendrerit at vulputate vitae nisl aenean lectus pellentesque eget nunc donec quis orci eget,5/3/1988,9/26/1977
