id,building_id,employee_id,building_type,status,date_of_installation,date_of_inspection,inspection_certificate,information,notes,created_at,updated_at
1,1,1,Commercial,Inactive,8/30/2014,3/16/2017,Certified,"Nam congue, risus semper porta volutpat, quam pede lobortis ligula, sit amet eleifend pede libero quis orci. Nullam molestie nibh in lectus. Pellentesque at nulla. Suspendisse potenti. Cras in purus eu magna vulputate luctus.",in faucibus orci luctus et ultrices posuere cubilia curae duis faucibus accumsan odio curabitur convallis duis consequat,11/19/1985,9/3/2008
2,2,2,Residential,Inactive,11/10/1986,5/7/1999,Certified,"Nulla tempus. Vivamus in felis eu sapien cursus vestibulum. Proin eu mi. Nulla ac enim. In tempor, turpis nec euismod scelerisque, quam turpis adipiscing lorem, vitae mattis nibh ligula nec sem. Duis aliquam convallis nunc. Proin at turpis a pede posuere nonummy. Integer non velit. Donec diam neque, vestibulum eget, vulputate ut, ultrices vel, augue. Vestibulum ante ipsum primis in faucibus orci luctus et ultrices posuere cubilia Curae; Donec pharetra, magna vestibulum aliquet ultrices, erat tortor sollicitudin mi, sit amet lobortis sapien sapien non mi.",eleifend quam a odio in hac habitasse platea dictumst maecenas ut massa quis augue luctus tincidunt nulla mollis,6/4/1982,9/30/2000
3,3,3,Corporate,Active,9/14/1979,8/29/1977,Certified,Etiam pretium iaculis justo. In hac habitasse platea dictumst. Etiam faucibus cursus urna. Ut tellus. Nulla ut erat id mauris vulputate elementum. Nullam varius. Nulla facilisi. Cras non velit nec nisi vulputate nonummy. Maecenas tincidunt lacus at velit.,proin interdum mauris non ligula pellentesque ultrices phasellus id sapien in sapien iaculis congue vivamus,11/25/2012,4/20/2001
4,4,4,Hybrid,Inactive,6/1/1980,3/11/1980,Not Certified,"Donec posuere metus vitae ipsum. Aliquam non mauris. Morbi non lectus. Aliquam sit amet diam in magna bibendum imperdiet. Nullam orci pede, venenatis non, sodales sed, tincidunt eu, felis. Fusce posuere felis sed lacus.",vel accumsan tellus nisi eu orci mauris lacinia sapien quis libero nullam sit amet turpis elementum ligula vehicula consequat,10/2/1999,3/9/1989
5,5,5,Hybrid,Inactive,5/18/1999,2/3/1978,Not Certified,"Vestibulum ac est lacinia nisi venenatis tristique. Fusce congue, diam id ornare imperdiet, sapien urna pretium nisl, ut volutpat sapien arcu sed augue. Aliquam erat volutpat. In congue. Etiam justo. Etiam pretium iaculis justo. In hac habitasse platea dictumst.",ipsum ac tellus semper interdum mauris ullamcorper purus sit amet nulla quisque arcu,8/8/1997,1/13/2018
6,6,6,Commercial,Active,4/25/2011,4/26/2005,Certified,"Integer non velit. Donec diam neque, vestibulum eget, vulputate ut, ultrices vel, augue. Vestibulum ante ipsum primis in faucibus orci luctus et ultrices posuere cubilia Curae; Donec pharetra, magna vestibulum aliquet ultrices, erat tortor sollicitudin mi, sit amet lobortis sapien sapien non mi. Integer ac neque. Duis bibendum. Morbi non quam nec dui luctus rutrum. Nulla tellus. In sagittis dui vel nisl.",nulla pede ullamcorper augue a suscipit nulla elit ac nulla sed vel enim sit,3/17/2006,10/21/2004
7,7,7,Hybrid,Inactive,1/19/2013,1/11/1999,Certified,"Pellentesque at nulla. Suspendisse potenti. Cras in purus eu magna vulputate luctus. Cum sociis natoque penatibus et magnis dis parturient montes, nascetur ridiculus mus. Vivamus vestibulum sagittis sapien. Cum sociis natoque penatibus et magnis dis parturient montes, nascetur ridiculus mus. Etiam vel augue. Vestibulum rutrum rutrum neque.",sagittis dui vel nisl duis ac nibh fusce lacus purus aliquet at,3/26/2007,8/26/1993
8,8,8,Commercial,Active,12/27/2015,6/12/1997,Certified,"Lorem ipsum dolor sit amet, consectetuer adipiscing elit. Proin interdum mauris non ligula pellentesque ultrices. Phasellus id sapien in sapien iaculis congue. Vivamus metus arcu, adipiscing molestie, hendrerit at, vulputate vitae, nisl. Aenean lectus. Pellentesque eget nunc. Donec quis orci eget orci vehicula condimentum. Curabitur in libero ut massa volutpat convallis. Morbi odio odio, elementum eu, interdum eu, tincidunt in, leo. Maecenas pulvinar lobortis est.",cras non velit nec nisi vulputate nonummy maecenas tincidunt lacus at velit vivamus,2/20/1976,10/20/1975
9,9,9,Corporate,Inactive,6/5/2014,4/2/1983,Certified,Sed ante. Vivamus tortor. Duis mattis egestas metus. Aenean fermentum. Donec ut mauris eget massa tempor convallis.,faucibus orci luctus et ultrices posuere cubilia curae duis faucibus accumsan odio curabitur convallis duis consequat dui nec nisi,8/14/2013,9/12/2007
10,10,10,Residential,Active,10/25/2000,6/7/1993,Certified,"Nunc purus. Phasellus in felis. Donec semper sapien a libero. Nam dui. Proin leo odio, porttitor id, consequat in, consequat ut, nulla.",vel est donec odio justo sollicitudin ut suscipit a feugiat et eros,6/26/2004,1/5/1980
11,11,11,Hybrid,Inactive,8/22/1999,12/6/1977,Certified,"Vivamus vel nulla eget eros elementum pellentesque. Quisque porta volutpat erat. Quisque erat eros, viverra eget, congue eget, semper rutrum, nulla. Nunc purus. Phasellus in felis. Donec semper sapien a libero. Nam dui. Proin leo odio, porttitor id, consequat in, consequat ut, nulla.",donec dapibus duis at velit eu est congue elementum in hac habitasse platea dictumst,9/11/2007,9/16/1995
12,12,12,Corporate,Inactive,10/15/2017,2/26/1997,Not Certified,"Sed sagittis. Nam congue, risus semper porta volutpat, quam pede lobortis ligula, sit amet eleifend pede libero quis orci. Nullam molestie nibh in lectus. Pellentesque at nulla. Suspendisse potenti. Cras in purus eu magna vulputate luctus. Cum sociis natoque penatibus et magnis dis parturient montes, nascetur ridiculus mus. Vivamus vestibulum sagittis sapien. Cum sociis natoque penatibus et magnis dis parturient montes, nascetur ridiculus mus.",quam sollicitudin vitae consectetuer eget rutrum at lorem integer tincidunt,5/6/1991,1/22/1988
13,13,13,Residential,Active,7/24/2018,6/26/2017,Not Certified,"Nullam molestie nibh in lectus. Pellentesque at nulla. Suspendisse potenti. Cras in purus eu magna vulputate luctus. Cum sociis natoque penatibus et magnis dis parturient montes, nascetur ridiculus mus. Vivamus vestibulum sagittis sapien. Cum sociis natoque penatibus et magnis dis parturient montes, nascetur ridiculus mus. Etiam vel augue. Vestibulum rutrum rutrum neque.",ante ipsum primis in faucibus orci luctus et ultrices posuere cubilia curae donec pharetra,10/5/2013,6/8/2017
14,14,14,Residential,Active,10/1/1990,12/28/1989,Certified,"Vestibulum rutrum rutrum neque. Aenean auctor gravida sem. Praesent id massa id nisl venenatis lacinia. Aenean sit amet justo. Morbi ut odio. Cras mi pede, malesuada in, imperdiet et, commodo vulputate, justo.",ut odio cras mi pede malesuada in imperdiet et commodo,11/6/1976,12/24/2003
15,15,15,Hybrid,Inactive,3/5/1980,4/9/1979,Certified,"Morbi non lectus. Aliquam sit amet diam in magna bibendum imperdiet. Nullam orci pede, venenatis non, sodales sed, tincidunt eu, felis. Fusce posuere felis sed lacus. Morbi sem mauris, laoreet ut, rhoncus aliquet, pulvinar sed, nisl. Nunc rhoncus dui vel sem. Sed sagittis. Nam congue, risus semper porta volutpat, quam pede lobortis ligula, sit amet eleifend pede libero quis orci. Nullam molestie nibh in lectus. Pellentesque at nulla.",lorem id ligula suspendisse ornare consequat lectus in est risus auctor sed tristique,5/16/1997,4/27/2003
16,16,16,Hybrid,Inactive,6/7/2003,8/26/2010,Not Certified,"Maecenas leo odio, condimentum id, luctus nec, molestie sed, justo. Pellentesque viverra pede ac diam. Cras pellentesque volutpat dui. Maecenas tristique, est et tempus semper, est quam pharetra magna, ac consequat metus sapien ut nunc. Vestibulum ante ipsum primis in faucibus orci luctus et ultrices posuere cubilia Curae; Mauris viverra diam vitae quam. Suspendisse potenti.",vestibulum rutrum rutrum neque aenean auctor gravida sem praesent id,7/19/1995,9/3/1999
17,17,17,Corporate,Active,12/9/1983,2/13/1996,Certified,"Vestibulum ante ipsum primis in faucibus orci luctus et ultrices posuere cubilia Curae; Donec pharetra, magna vestibulum aliquet ultrices, erat tortor sollicitudin mi, sit amet lobortis sapien sapien non mi. Integer ac neque. Duis bibendum. Morbi non quam nec dui luctus rutrum. Nulla tellus. In sagittis dui vel nisl. Duis ac nibh.",condimentum curabitur in libero ut massa volutpat convallis morbi odio odio elementum eu interdum eu tincidunt in leo maecenas pulvinar,12/29/1976,7/29/1995
18,18,18,Corporate,Inactive,1/31/1987,4/25/2019,Certified,"In quis justo. Maecenas rhoncus aliquam lacus. Morbi quis tortor id nulla ultrices aliquet. Maecenas leo odio, condimentum id, luctus nec, molestie sed, justo. Pellentesque viverra pede ac diam. Cras pellentesque volutpat dui. Maecenas tristique, est et tempus semper, est quam pharetra magna, ac consequat metus sapien ut nunc. Vestibulum ante ipsum primis in faucibus orci luctus et ultrices posuere cubilia Curae; Mauris viverra diam vitae quam. Suspendisse potenti.",ipsum primis in faucibus orci luctus et ultrices posuere cubilia curae duis faucibus accumsan,4/2/2004,5/29/2016
19,19,19,Hybrid,Inactive,12/28/1980,3/21/1980,Not Certified,"In quis justo. Maecenas rhoncus aliquam lacus. Morbi quis tortor id nulla ultrices aliquet. Maecenas leo odio, condimentum id, luctus nec, molestie sed, justo. Pellentesque viverra pede ac diam. Cras pellentesque volutpat dui. Maecenas tristique, est et tempus semper, est quam pharetra magna, ac consequat metus sapien ut nunc. Vestibulum ante ipsum primis in faucibus orci luctus et ultrices posuere cubilia Curae; Mauris viverra diam vitae quam. Suspendisse potenti.",iaculis justo in hac habitasse platea dictumst etiam faucibus cursus urna ut tellus nulla ut erat id mauris vulputate,12/23/2004,7/26/1976
20,20,20,Residential,Inactive,6/1/2002,10/4/2010,Certified,"Praesent id massa id nisl venenatis lacinia. Aenean sit amet justo. Morbi ut odio. Cras mi pede, malesuada in, imperdiet et, commodo vulputate, justo. In blandit ultrices enim.",justo aliquam quis turpis eget elit sodales scelerisque mauris sit amet eros suspendisse accumsan tortor quis turpis sed ante vivamus,1/16/2011,11/9/1979
21,21,21,Corporate,Active,3/2/1988,8/27/1978,Certified,"Proin risus. Praesent lectus. Vestibulum quam sapien, varius ut, blandit non, interdum in, ante. Vestibulum ante ipsum primis in faucibus orci luctus et ultrices posuere cubilia Curae; Duis faucibus accumsan odio. Curabitur convallis.",ante ipsum primis in faucibus orci luctus et ultrices posuere cubilia curae nulla dapibus dolor vel est donec odio,6/15/1976,7/22/1997
22,22,22,Hybrid,Active,12/9/2018,2/5/2002,Not Certified,"Cras non velit nec nisi vulputate nonummy. Maecenas tincidunt lacus at velit. Vivamus vel nulla eget eros elementum pellentesque. Quisque porta volutpat erat. Quisque erat eros, viverra eget, congue eget, semper rutrum, nulla. Nunc purus. Phasellus in felis.",imperdiet nullam orci pede venenatis non sodales sed tincidunt eu felis fusce posuere felis sed lacus morbi,3/12/2011,6/26/1986
23,23,23,Residential,Active,8/7/1982,8/28/1990,Not Certified,"Maecenas rhoncus aliquam lacus. Morbi quis tortor id nulla ultrices aliquet. Maecenas leo odio, condimentum id, luctus nec, molestie sed, justo. Pellentesque viverra pede ac diam. Cras pellentesque volutpat dui. Maecenas tristique, est et tempus semper, est quam pharetra magna, ac consequat metus sapien ut nunc. Vestibulum ante ipsum primis in faucibus orci luctus et ultrices posuere cubilia Curae; Mauris viverra diam vitae quam.",viverra eget congue eget semper rutrum nulla nunc purus phasellus in felis donec semper sapien a,6/9/1987,9/10/2017
24,24,24,Residential,Inactive,7/25/1977,11/24/2005,Certified,"In quis justo. Maecenas rhoncus aliquam lacus. Morbi quis tortor id nulla ultrices aliquet. Maecenas leo odio, condimentum id, luctus nec, molestie sed, justo. Pellentesque viverra pede ac diam. Cras pellentesque volutpat dui. Maecenas tristique, est et tempus semper, est quam pharetra magna, ac consequat metus sapien ut nunc. Vestibulum ante ipsum primis in faucibus orci luctus et ultrices posuere cubilia Curae; Mauris viverra diam vitae quam.",faucibus accumsan odio curabitur convallis duis consequat dui nec nisi volutpat eleifend donec ut dolor morbi vel lectus in quam,7/15/2011,10/14/1990
25,25,25,Hybrid,Inactive,7/31/1981,3/29/1982,Not Certified,"Sed sagittis. Nam congue, risus semper porta volutpat, quam pede lobortis ligula, sit amet eleifend pede libero quis orci. Nullam molestie nibh in lectus. Pellentesque at nulla. Suspendisse potenti. Cras in purus eu magna vulputate luctus. Cum sociis natoque penatibus et magnis dis parturient montes, nascetur ridiculus mus. Vivamus vestibulum sagittis sapien. Cum sociis natoque penatibus et magnis dis parturient montes, nascetur ridiculus mus.",vestibulum ante ipsum primis in faucibus orci luctus et ultrices posuere,9/15/1998,2/28/1987
26,26,26,Corporate,Active,1/15/2014,5/22/2016,Not Certified,"Donec dapibus. Duis at velit eu est congue elementum. In hac habitasse platea dictumst. Morbi vestibulum, velit id pretium iaculis, diam erat fermentum justo, nec condimentum neque sapien placerat ante. Nulla justo. Aliquam quis turpis eget elit sodales scelerisque. Mauris sit amet eros. Suspendisse accumsan tortor quis turpis.",in hac habitasse platea dictumst morbi vestibulum velit id pretium iaculis diam,1/1/2013,7/21/2005
27,27,27,Residential,Active,7/30/1983,9/19/1985,Certified,"Aenean auctor gravida sem. Praesent id massa id nisl venenatis lacinia. Aenean sit amet justo. Morbi ut odio. Cras mi pede, malesuada in, imperdiet et, commodo vulputate, justo.",quis odio consequat varius integer ac leo pellentesque ultrices mattis odio donec vitae nisi nam ultrices libero,8/20/2014,4/26/1994
28,28,28,Commercial,Active,9/11/1978,2/26/1982,Not Certified,"Phasellus in felis. Donec semper sapien a libero. Nam dui. Proin leo odio, porttitor id, consequat in, consequat ut, nulla. Sed accumsan felis. Ut at dolor quis odio consequat varius. Integer ac leo. Pellentesque ultrices mattis odio. Donec vitae nisi.",pede libero quis orci nullam molestie nibh in lectus pellentesque at nulla suspendisse potenti cras in,12/17/2008,10/26/1997
29,29,29,Hybrid,Inactive,11/2/2014,5/22/2005,Not Certified,In eleifend quam a odio. In hac habitasse platea dictumst. Maecenas ut massa quis augue luctus tincidunt. Nulla mollis molestie lorem. Quisque ut erat.,amet cursus id turpis integer aliquet massa id lobortis convallis tortor risus dapibus,7/22/2017,6/27/1995
30,30,30,Corporate,Inactive,12/11/2018,1/2/1982,Not Certified,"Duis bibendum. Morbi non quam nec dui luctus rutrum. Nulla tellus. In sagittis dui vel nisl. Duis ac nibh. Fusce lacus purus, aliquet at, feugiat non, pretium quis, lectus. Suspendisse potenti. In eleifend quam a odio. In hac habitasse platea dictumst. Maecenas ut massa quis augue luctus tincidunt.",elit ac nulla sed vel enim sit amet nunc viverra dapibus nulla suscipit ligula in,11/14/1978,11/16/1976
31,31,31,Residential,Inactive,11/6/2014,3/27/2003,Certified,"Donec semper sapien a libero. Nam dui. Proin leo odio, porttitor id, consequat in, consequat ut, nulla. Sed accumsan felis. Ut at dolor quis odio consequat varius.",eros vestibulum ac est lacinia nisi venenatis tristique fusce congue diam id ornare,6/13/2019,12/17/1987
32,32,32,Hybrid,Inactive,4/24/1986,1/18/1995,Certified,In congue. Etiam justo. Etiam pretium iaculis justo. In hac habitasse platea dictumst. Etiam faucibus cursus urna. Ut tellus. Nulla ut erat id mauris vulputate elementum. Nullam varius. Nulla facilisi. Cras non velit nec nisi vulputate nonummy.,sed tristique in tempus sit amet sem fusce consequat nulla nisl nunc nisl duis bibendum felis sed interdum venenatis,2/9/1999,10/15/1994
33,33,33,Corporate,Active,8/11/2013,7/15/1976,Not Certified,Phasellus sit amet erat. Nulla tempus. Vivamus in felis eu sapien cursus vestibulum. Proin eu mi. Nulla ac enim.,morbi porttitor lorem id ligula suspendisse ornare consequat lectus in est risus auctor sed tristique in,6/21/1988,3/31/1981
34,34,34,Corporate,Active,8/28/2006,10/3/2006,Not Certified,"Nullam varius. Nulla facilisi. Cras non velit nec nisi vulputate nonummy. Maecenas tincidunt lacus at velit. Vivamus vel nulla eget eros elementum pellentesque. Quisque porta volutpat erat. Quisque erat eros, viverra eget, congue eget, semper rutrum, nulla.",ipsum primis in faucibus orci luctus et ultrices posuere cubilia curae duis faucibus accumsan odio curabitur convallis duis consequat dui,3/7/2009,12/12/2000
35,35,35,Commercial,Inactive,8/7/1983,6/8/2004,Not Certified,"Vestibulum ante ipsum primis in faucibus orci luctus et ultrices posuere cubilia Curae; Duis faucibus accumsan odio. Curabitur convallis. Duis consequat dui nec nisi volutpat eleifend. Donec ut dolor. Morbi vel lectus in quam fringilla rhoncus. Mauris enim leo, rhoncus sed, vestibulum sit amet, cursus id, turpis.",magna vulputate luctus cum sociis natoque penatibus et magnis dis parturient montes nascetur ridiculus mus vivamus vestibulum sagittis,3/4/1992,12/11/2016
36,36,36,Residential,Inactive,4/12/1994,2/12/1980,Not Certified,"Curabitur gravida nisi at nibh. In hac habitasse platea dictumst. Aliquam augue quam, sollicitudin vitae, consectetuer eget, rutrum at, lorem. Integer tincidunt ante vel ipsum. Praesent blandit lacinia erat. Vestibulum sed magna at nunc commodo placerat.",quam nec dui luctus rutrum nulla tellus in sagittis dui vel nisl duis ac nibh fusce lacus purus aliquet,7/31/2016,11/22/1978
37,37,37,Hybrid,Inactive,11/27/1998,9/28/1996,Certified,"Nullam porttitor lacus at turpis. Donec posuere metus vitae ipsum. Aliquam non mauris. Morbi non lectus. Aliquam sit amet diam in magna bibendum imperdiet. Nullam orci pede, venenatis non, sodales sed, tincidunt eu, felis. Fusce posuere felis sed lacus. Morbi sem mauris, laoreet ut, rhoncus aliquet, pulvinar sed, nisl.",libero convallis eget eleifend luctus ultricies eu nibh quisque id,10/11/2002,1/29/2010
38,38,38,Hybrid,Active,6/4/2019,7/9/1979,Certified,"Lorem ipsum dolor sit amet, consectetuer adipiscing elit. Proin interdum mauris non ligula pellentesque ultrices. Phasellus id sapien in sapien iaculis congue. Vivamus metus arcu, adipiscing molestie, hendrerit at, vulputate vitae, nisl. Aenean lectus. Pellentesque eget nunc. Donec quis orci eget orci vehicula condimentum. Curabitur in libero ut massa volutpat convallis. Morbi odio odio, elementum eu, interdum eu, tincidunt in, leo. Maecenas pulvinar lobortis est.",sit amet sapien dignissim vestibulum vestibulum ante ipsum primis in faucibus orci luctus et ultrices posuere cubilia curae nulla dapibus,6/3/1994,3/4/1977
39,39,39,Hybrid,Inactive,9/17/1980,10/2/1998,Certified,"Nunc nisl. Duis bibendum, felis sed interdum venenatis, turpis enim blandit mi, in porttitor pede justo eu massa. Donec dapibus. Duis at velit eu est congue elementum. In hac habitasse platea dictumst.",ligula vehicula consequat morbi a ipsum integer a nibh in quis justo maecenas rhoncus,8/14/2014,3/30/1990
40,40,40,Corporate,Active,1/25/1988,1/29/1988,Certified,"Vivamus vel nulla eget eros elementum pellentesque. Quisque porta volutpat erat. Quisque erat eros, viverra eget, congue eget, semper rutrum, nulla. Nunc purus. Phasellus in felis.",nisl nunc nisl duis bibendum felis sed interdum venenatis turpis enim blandit mi in porttitor,6/22/2011,7/20/2014
41,41,41,Commercial,Inactive,10/10/2005,9/24/2010,Not Certified,"Vivamus vel nulla eget eros elementum pellentesque. Quisque porta volutpat erat. Quisque erat eros, viverra eget, congue eget, semper rutrum, nulla. Nunc purus. Phasellus in felis. Donec semper sapien a libero. Nam dui. Proin leo odio, porttitor id, consequat in, consequat ut, nulla. Sed accumsan felis.",nulla suspendisse potenti cras in purus eu magna vulputate luctus cum sociis natoque penatibus et magnis dis,12/6/2002,12/2/1988
42,42,42,Commercial,Inactive,12/27/1999,10/22/1996,Certified,"Morbi ut odio. Cras mi pede, malesuada in, imperdiet et, commodo vulputate, justo. In blandit ultrices enim. Lorem ipsum dolor sit amet, consectetuer adipiscing elit. Proin interdum mauris non ligula pellentesque ultrices. Phasellus id sapien in sapien iaculis congue. Vivamus metus arcu, adipiscing molestie, hendrerit at, vulputate vitae, nisl. Aenean lectus. Pellentesque eget nunc. Donec quis orci eget orci vehicula condimentum.",justo in blandit ultrices enim lorem ipsum dolor sit amet consectetuer adipiscing elit proin interdum mauris non ligula pellentesque ultrices,8/16/1991,5/5/1999
43,43,43,Hybrid,Inactive,5/13/1994,3/17/2016,Not Certified,"Fusce lacus purus, aliquet at, feugiat non, pretium quis, lectus. Suspendisse potenti. In eleifend quam a odio. In hac habitasse platea dictumst. Maecenas ut massa quis augue luctus tincidunt.",molestie sed justo pellentesque viverra pede ac diam cras pellentesque volutpat dui maecenas tristique est et tempus semper est quam,1/25/2002,11/12/2010
44,44,44,Residential,Active,9/17/2013,7/23/2010,Not Certified,"Morbi a ipsum. Integer a nibh. In quis justo. Maecenas rhoncus aliquam lacus. Morbi quis tortor id nulla ultrices aliquet. Maecenas leo odio, condimentum id, luctus nec, molestie sed, justo. Pellentesque viverra pede ac diam.",orci luctus et ultrices posuere cubilia curae donec pharetra magna vestibulum aliquet ultrices erat tortor sollicitudin,9/15/2014,11/23/1989
45,45,45,Hybrid,Active,9/28/1990,5/30/1983,Not Certified,"Sed ante. Vivamus tortor. Duis mattis egestas metus. Aenean fermentum. Donec ut mauris eget massa tempor convallis. Nulla neque libero, convallis eget, eleifend luctus, ultricies eu, nibh. Quisque id justo sit amet sapien dignissim vestibulum.",velit nec nisi vulputate nonummy maecenas tincidunt lacus at velit vivamus vel nulla eget eros elementum pellentesque quisque porta volutpat,3/30/2003,9/2/2018
46,46,46,Hybrid,Inactive,11/30/2018,4/5/2005,Certified,Ut tellus. Nulla ut erat id mauris vulputate elementum. Nullam varius. Nulla facilisi. Cras non velit nec nisi vulputate nonummy. Maecenas tincidunt lacus at velit. Vivamus vel nulla eget eros elementum pellentesque. Quisque porta volutpat erat.,magna vulputate luctus cum sociis natoque penatibus et magnis dis parturient montes,8/4/2011,8/11/2000
47,47,47,Commercial,Active,7/29/1999,5/30/2004,Certified,Etiam faucibus cursus urna. Ut tellus. Nulla ut erat id mauris vulputate elementum. Nullam varius. Nulla facilisi. Cras non velit nec nisi vulputate nonummy.,interdum mauris ullamcorper purus sit amet nulla quisque arcu libero,3/8/2007,9/21/1986
48,48,48,Corporate,Inactive,6/29/1992,9/8/1979,Certified,"Integer tincidunt ante vel ipsum. Praesent blandit lacinia erat. Vestibulum sed magna at nunc commodo placerat. Praesent blandit. Nam nulla. Integer pede justo, lacinia eget, tincidunt eget, tempus vel, pede. Morbi porttitor lorem id ligula. Suspendisse ornare consequat lectus. In est risus, auctor sed, tristique in, tempus sit amet, sem.",id nisl venenatis lacinia aenean sit amet justo morbi ut odio,5/1/1977,1/16/1985
49,49,49,Corporate,Inactive,3/13/1990,3/25/1998,Certified,"Morbi quis tortor id nulla ultrices aliquet. Maecenas leo odio, condimentum id, luctus nec, molestie sed, justo. Pellentesque viverra pede ac diam. Cras pellentesque volutpat dui. Maecenas tristique, est et tempus semper, est quam pharetra magna, ac consequat metus sapien ut nunc. Vestibulum ante ipsum primis in faucibus orci luctus et ultrices posuere cubilia Curae; Mauris viverra diam vitae quam. Suspendisse potenti. Nullam porttitor lacus at turpis. Donec posuere metus vitae ipsum.",eu magna vulputate luctus cum sociis natoque penatibus et magnis dis parturient montes,2/11/1993,1/22/1977
50,50,50,Residential,Inactive,8/23/2004,11/24/1988,Certified,"Vivamus tortor. Duis mattis egestas metus. Aenean fermentum. Donec ut mauris eget massa tempor convallis. Nulla neque libero, convallis eget, eleifend luctus, ultricies eu, nibh. Quisque id justo sit amet sapien dignissim vestibulum. Vestibulum ante ipsum primis in faucibus orci luctus et ultrices posuere cubilia Curae; Nulla dapibus dolor vel est. Donec odio justo, sollicitudin ut, suscipit a, feugiat et, eros. Vestibulum ac est lacinia nisi venenatis tristique.",eget elit sodales scelerisque mauris sit amet eros suspendisse accumsan tortor quis turpis sed ante vivamus tortor duis mattis,6/30/1978,7/27/1994
51,51,51,Commercial,Active,3/12/2013,1/11/2018,Certified,"Morbi a ipsum. Integer a nibh. In quis justo. Maecenas rhoncus aliquam lacus. Morbi quis tortor id nulla ultrices aliquet. Maecenas leo odio, condimentum id, luctus nec, molestie sed, justo. Pellentesque viverra pede ac diam. Cras pellentesque volutpat dui. Maecenas tristique, est et tempus semper, est quam pharetra magna, ac consequat metus sapien ut nunc. Vestibulum ante ipsum primis in faucibus orci luctus et ultrices posuere cubilia Curae; Mauris viverra diam vitae quam.",lorem id ligula suspendisse ornare consequat lectus in est risus auctor sed tristique in tempus sit amet sem fusce,8/28/2012,5/23/1992
52,52,52,Hybrid,Active,11/9/1977,9/22/1984,Not Certified,"Pellentesque viverra pede ac diam. Cras pellentesque volutpat dui. Maecenas tristique, est et tempus semper, est quam pharetra magna, ac consequat metus sapien ut nunc. Vestibulum ante ipsum primis in faucibus orci luctus et ultrices posuere cubilia Curae; Mauris viverra diam vitae quam. Suspendisse potenti. Nullam porttitor lacus at turpis. Donec posuere metus vitae ipsum. Aliquam non mauris.",vitae ipsum aliquam non mauris morbi non lectus aliquam sit amet diam in magna,9/17/1976,4/14/1996
